{
  "id": "dso:M2",
  "version": 1,
  "title": {
    "ko": "M2",
    "en": "M2"
  },
  "oneLiner": {
    "ko": "물병자리의 작은 둥근 빛에서 중심 집중을 비교하는 구상성단"
  },
  "summary": {
    "ko": "M2는 물병자리의 구상성단으로 많은 별의 빛이 모여 둥근 빛무리처럼 보입니다. 밝은 별이 드문 가을 구역에서 찾으려면 큰 별자리 배열을 먼저 익히고 지도와 대조해야 합니다. 쌍안경에서는 작은 흐림, 90mm 망원경에서는 중심과 바깥의 밝기 차이가 기본 관측 목표입니다. 도시에서는 성단의 약한 외곽이 사라질 수 있습니다. 같은 계절의 M15와 비교하면 모양과 관측 조건을 기록하기 좋습니다. 첨부 거리와 NASA 소개값의 차이가 커 이 초안의 사실표에서는 확정 거리 숫자를 보류했습니다."
  },
  "facts": [
    {
      "label": "종류",
      "value": "구상성단",
      "source": "첨부 catalog-values.v1.csv — dso:M2; inputs/catalog-values.v1.csv의 원본 행; NASA — Messier 2 — https://science.nasa.gov/mission/hubble/science/explore-the-night-sky/hubble-messier-catalog/messier-2/"
    },
    {
      "label": "별자리",
      "value": "물병자리 (Aqr)",
      "source": "첨부 catalog-values.v1.csv — dso:M2; inputs/catalog-values.v1.csv의 원본 행; 첨부 G2 constellations_ko.csv — inputs/constellations_ko.csv; 한국어명·IAU 약어·속격"
    },
    {
      "label": "겉보기등급(첨부·대역 미확인)",
      "value": "6.25등급 — V 대역 확정 전",
      "source": "첨부 catalog-values.v1.csv — dso:M2; inputs/catalog-values.v1.csv의 원본 행"
    },
    {
      "label": "각크기(첨부)",
      "value": "8.4′ — 카탈로그 범위",
      "source": "첨부 catalog-values.v1.csv — dso:M2; inputs/catalog-values.v1.csv의 원본 행"
    },
    {
      "label": "거리",
      "value": "게시 보류 — 원본과 외부 소개값 불일치",
      "source": "첨부 catalog-values.v1.csv — dso:M2; inputs/catalog-values.v1.csv의 원본 행; NASA — Messier 2 — https://science.nasa.gov/mission/hubble/science/explore-the-night-sky/hubble-messier-catalog/messier-2/"
    },
    {
      "label": "목록 식별자",
      "value": "M2",
      "source": "첨부 catalog-values.v1.csv — dso:M2; inputs/catalog-values.v1.csv의 원본 행"
    }
  ],
  "story": {
    "ko": "M2는 혜성을 관측하던 중 발견된 구상성단으로 소개됩니다. 흐린 빛을 보았다는 사실만으로 움직이는 혜성인지 많은 별이 모인 성단인지 알 수 없었던 시기에 위치와 반복 관측은 중요한 구별 수단이었습니다. 오늘날 앱은 정체를 바로 알려 주지만, 실제 시야에서는 여전히 작은 둥근 얼룩부터 만나게 됩니다. 관측자는 이름을 읽은 지식과 직접 확인한 모습을 나누어 기록할 수 있습니다. 낮은 배율로 위치를 확정하고 배율을 조금 높여 중심의 집중이 어떻게 달라지는지 살펴보세요. M15와 같은 배율에서 비교하면 구상성단들이 모두 같은 빛 공처럼 보이는 것은 아님을 느낄 수 있습니다. 상세한 별의 수나 나이를 시야만으로 알아냈다고 생각하지 않고, 보이는 구조와 연구로 알려진 성질을 함께 읽는 연습에 적합합니다.",
    "cultures": [
      "기타"
    ],
    "sources": [
      "NASA — Messier 2 — https://science.nasa.gov/mission/hubble/science/explore-the-night-sky/hubble-messier-catalog/messier-2/"
    ]
  },
  "howToFind": {
    "ko": "가을에 페가수스자리와 물병자리의 큰 배치를 확인합니다. 물병자리 북쪽의 M2를 지도에서 선택해 주변 별을 단계적으로 좁힙니다. 비교 대상 M15는 별도 위치이므로 각 성단에서 중심과 바깥 퍼짐을 따로 기록하세요.",
    "season": "autumn",
    "hopFrom": [
      "const:Aqr",
      "const:Peg",
      "dso:M15"
    ]
  },
  "observing": {
    "nakedEye": "도시 맨눈 관측 대상으로 사용하지 않습니다.",
    "binoculars": "10×50으로 작은 둥근 흐림을 찾고 별과 구별합니다.",
    "telescope": "90mm 20~80배에서는 중심 집중과 바깥 퍼짐 검출이 기본입니다. 핵심부의 별을 모두 분리할 수 있다고 보장하지 않습니다.",
    "difficulty": 3,
    "bestMonths": [
      9,
      10,
      11
    ]
  },
  "sources": [
    "첨부 catalog-values.v1.csv — dso:M2; inputs/catalog-values.v1.csv의 원본 행",
    "첨부 G2 constellations_ko.csv — inputs/constellations_ko.csv; 한국어명·IAU 약어·속격",
    "편집 제안 — observing-policy.md; 북위36.35°·10×50·90mm 20~80배, 실측 아님",
    "첨부 catalog-values.v1.csv — 길잡이 연계 행: const:Aqr, const:Peg, dso:M15; inputs/catalog-values.v1.csv",
    "NASA — How to Find Good Places to Stargaze — https://science.nasa.gov/solar-system/how-to-find-good-places-to-stargaze/",
    "NASA — Messier 2 — https://science.nasa.gov/mission/hubble/science/explore-the-night-sky/hubble-messier-catalog/messier-2/",
    "첨부 catalog-values.v1.csv — dso:M2; inputs/catalog-values.v1.csv의 원본 행; NASA — Messier 2 — https://science.nasa.gov/mission/hubble/science/explore-the-night-sky/hubble-messier-catalog/messier-2/",
    "첨부 catalog-values.v1.csv — dso:M2; inputs/catalog-values.v1.csv의 원본 행; 첨부 G2 constellations_ko.csv — inputs/constellations_ko.csv; 한국어명·IAU 약어·속격"
  ],
  "meta": {
    "generatedBy": "gpt-5-pro",
    "generatedAt": "2026-09-07",
    "confidence": "low",
    "needsReview": [
      "장비별 관측 안내·추천 월·난이도는 보수적인 편집 제안입니다. 실제 기기·날씨·광해에서 관측 성공을 보장하지 않습니다.",
      "첨부 영어 이름은 빈칸으로 보존했습니다. title.en에는 새 고유명을 만들지 않고 목록 식별자를 표시용으로 사용했습니다.",
      "입력 거리 53294광년과 외부 소개값 37000광년을 대조했으나 단일값을 확정하지 않았습니다. 원본은 보존하고 숫자 표시는 보류합니다.",
      "입력 mag 열의 측광 대역이 확인되지 않았습니다. V등급으로 재명명하거나 검증 전 밝기 비교 퀴즈에 사용하지 않습니다.",
      "첨부 각크기는 해당 카탈로그의 측정/선택 범위로 보존했습니다. 사진 전체 윤곽·성단 구성원 전부·도시에서 보이는 경계와 동일하다고 보장하지 않습니다."
    ]
  }
}
