{
  "id": "dso:M51",
  "version": 1,
  "title": {
    "ko": "소용돌이은하",
    "en": "Whirlpool Galaxy"
  },
  "oneLiner": {
    "ko": "사진 속 나선팔보다 먼저 두 은하의 흐린 중심을 찾기"
  },
  "summary": {
    "ko": "소용돌이은하 M51은 사냥개자리 방향에서 나선 구조를 비교적 정면으로 보여 주는 은하입니다. 가까운 동반 은하 NGC5195와의 관계를 연구하는 대표적 대상으로 알려져 있습니다. 사진에는 감긴 나선팔과 두 은하의 구조가 뚜렷하지만 90mm 망원경에서는 훨씬 희미한 중심과 얼룩을 먼저 찾게 됩니다. 도시 광해에서는 존재 확인조차 어려울 수 있으므로 어두운 관측지를 권합니다. 전체 밝기를 나타내는 등급이 같더라도 별과 넓은 은하의 관측 난이도는 다르며, 나선팔을 보았다는 판단은 신중하게 해야 합니다."
  },
  "facts": [
    {
      "label": "종류",
      "value": "나선은하(동반 은하와 상호작용)",
      "source": "NASA — Messier 51: The Whirlpool Galaxy — https://science.nasa.gov/mission/hubble/science/explore-the-night-sky/hubble-messier-catalog/messier-51/"
    },
    {
      "label": "별자리",
      "value": "사냥개자리 (CVn)",
      "source": "첨부 catalog-values.v1.csv — dso:M51; inputs/catalog-values.v1.csv의 해당 행; 첨부 G2 constellations_ko.csv"
    },
    {
      "label": "겉보기등급(첨부·대역 미확인)",
      "value": "8.36등급",
      "source": "첨부 catalog-values.v1.csv — dso:M51; inputs/catalog-values.v1.csv의 해당 행"
    },
    {
      "label": "각크기(첨부 목록 기준)",
      "value": "13.71′ × 11.67′",
      "source": "첨부 catalog-values.v1.csv — dso:M51; inputs/catalog-values.v1.csv의 해당 행"
    },
    {
      "label": "목록 식별자",
      "value": "M51",
      "source": "첨부 catalog-values.v1.csv — dso:M51; inputs/catalog-values.v1.csv의 해당 행"
    },
    {
      "label": "거리",
      "value": "검토 보류 — 첨부 값과 외부 자료가 크게 다릅니다.",
      "source": "첨부 catalog-values.v1.csv — dso:M51; inputs/catalog-values.v1.csv의 해당 행; NASA — Messier 51: The Whirlpool Galaxy — https://science.nasa.gov/mission/hubble/science/explore-the-night-sky/hubble-messier-catalog/messier-51/"
    }
  ],
  "story": {
    "ko": "M51의 나선팔은 별과 가스가 은하 안에서 어떻게 분포하고 새로운 별이 어디에서 태어나는지 연구하는 단서입니다. 곁의 NGC5195와 중력적으로 영향을 주고받는 관계도 관심의 대상입니다. 우주망원경 영상은 밝은 별 무리와 어두운 먼지 띠를 세밀하게 구분하지만, 입문자의 접안렌즈에는 그 정보 대부분이 하나의 흐릿한 빛으로 합쳐집니다. 이름에 소용돌이가 들어간다고 실제 관측에서 감긴 팔을 반드시 알아보아야 하는 것은 아닙니다. 먼저 은하 위치와 중심의 존재를 확인하고 동반 은하의 빛까지 구분했는지 따로 적어 보세요. 전문 사진을 보고 기억한 모양을 관측 기록에 채우기보다, 그날 확인한 부분과 확인하지 못한 부분을 구별하는 것이 다음 시도의 기준이 됩니다.",
    "cultures": [
      "기타"
    ],
    "sources": [
      "NASA — Messier 51: The Whirlpool Galaxy — https://science.nasa.gov/mission/hubble/science/explore-the-night-sky/hubble-messier-catalog/messier-51/",
      "NASA Scientific Visualization Studio — A Flyby of the Whirlpool Galaxy — https://svs.gsfc.nasa.gov/31024/"
    ]
  },
  "howToFind": {
    "ko": "봄 저녁 북두칠성 손잡이 끝의 알카이드를 찾으세요. 그 별에서 천구의 남서쪽으로 약 3.6° 떨어진 구역을 지도와 맞추고 쌍안경 또는 망원경의 낮은 배율로 좁혀 갑니다. 주변 별 배열을 확인한 뒤 약한 얼룩을 찾으세요. 도시에서 보이지 않으면 무작정 배율을 올리기보다 어두운 조건에서 다시 시도합니다.",
    "season": "spring",
    "hopFrom": [
      "star:HIP67301",
      "const:UMa"
    ]
  },
  "observing": {
    "nakedEye": "맨눈 관측 대상이 아닙니다. 알카이드와 목표 구역을 찾는 단계까지만 맨눈을 사용하세요.",
    "binoculars": "10×50에서는 어두운 하늘과 안정된 지지가 있어도 희미한 얼룩 검출이 도전입니다. 도시 검출이나 나선 구조 확인을 기대하지 않습니다.",
    "telescope": "90mm 20~60배로 어두운 곳에서 중심의 얼룩을 먼저 찾습니다. 동반 은하의 빛을 분리하는 일은 추가 도전이며 나선팔·연결 구조·사진 색을 기본 성공 조건으로 삼지 않습니다.",
    "bestMonths": [
      4,
      5,
      6
    ],
    "difficulty": 5
  },
  "funFacts": [
    "사진의 선명한 나선팔이 작은 망원경에서 그대로 보이는 것은 아닙니다.",
    "M51과 동반 은하의 빛을 구별했는지는 따로 기록해야 합니다."
  ],
  "sources": [
    "첨부 catalog-values.v1.csv — dso:M51; inputs/catalog-values.v1.csv의 해당 행",
    "첨부 G2 constellations_ko.csv — inputs/constellations_ko.csv",
    "NASA — Messier 51: The Whirlpool Galaxy — https://science.nasa.gov/mission/hubble/science/explore-the-night-sky/hubble-messier-catalog/messier-51/",
    "NASA Scientific Visualization Studio — A Flyby of the Whirlpool Galaxy — https://svs.gsfc.nasa.gov/31024/",
    "NASA — Skywatching Tips — https://science.nasa.gov/skywatching/",
    "NASA — How to Find Good Places to Stargaze — https://science.nasa.gov/solar-system/how-to-find-good-places-to-stargaze/"
  ],
  "meta": {
    "generatedBy": "gpt-5-pro",
    "generatedAt": "2026-09-07",
    "confidence": "low",
    "needsReview": [
      "거리 수치 게시 보류: 첨부 418광년은 NASA의 약 3100만/2500만 광년 소개와 규모부터 다릅니다. 외부 자료 중 하나를 최신 정밀값으로 확정하지 않았습니다. 원값은 raw-selected-values.json에 보존했고 외부 후보값도 본문에 자동 대입하지 않았습니다.",
      "첨부 mag에는 측광 대역·목록 판본이 없습니다. V등급으로 확정하지 않았으며 밝기 순서·정밀 수치 퀴즈는 T0b 검증 전 보류합니다.",
      "M51은 문헌에서 주 은하 또는 동반 은하를 포함한 계를 가리키기도 합니다. 첨부 크기·등급의 적분 범위를 확인하고 NGC5195를 임의의 새 콘텐츠 ID로 추가하지 않습니다.",
      "관측 난이도와 10×50·90mm 20~80배 안내는 출처의 대상 특성과 광해 원칙에 근거한 보수적 편집 제안입니다. 실기기 관측·도시 검출 보장은 아닙니다.",
      "첨부 각크기의 측정 파장·경계 기준은 미확인입니다. 사진이나 실제 접안 시야에서 같은 범위가 보인다는 뜻으로 사용하지 않습니다."
    ]
  }
}
