{
  "id": "dso:M32",
  "version": 1,
  "title": {
    "ko": "M32",
    "en": "M32"
  },
  "oneLiner": {
    "ko": "안드로메다은하 곁에서 별처럼 작은 중심을 확인하는 동반 은하"
  },
  "summary": {
    "ko": "M32는 안드로메다은하 M31 곁에 보이는 작은 타원은하입니다. M31의 거대한 원반과 달리 중심이 조밀하게 보이는 것이 관측의 비교점입니다. 같은 시야에 들어오는 별 하나로 착각하기 쉬우므로 위치를 먼저 확인하고 빛이 퍼지는 모양을 살펴야 합니다. 맨눈으로 M31과 따로 구별하는 목표는 적합하지 않습니다. 쌍안경에서는 분리가 어려울 수 있고, 90mm 망원경에서도 도시 하늘에서는 밝은 중심만 작게 남을 수 있습니다. M31을 관측했다는 기록과 M32를 별도로 확인했다는 기록을 구분해 보세요."
  },
  "facts": [
    {
      "label": "종류",
      "value": "은하",
      "source": "첨부 catalog-values.v1.csv — dso:M32; inputs/catalog-values.v1.csv의 원본 행; NASA — Messier 32 — https://science.nasa.gov/mission/hubble/science/explore-the-night-sky/hubble-messier-catalog/messier-32/"
    },
    {
      "label": "별자리",
      "value": "안드로메다자리 (And)",
      "source": "첨부 catalog-values.v1.csv — dso:M32; inputs/catalog-values.v1.csv의 원본 행; 첨부 G2 constellations_ko.csv — inputs/constellations_ko.csv; 한국어명·IAU 약어·속격"
    },
    {
      "label": "겉보기등급(첨부·대역 미확인)",
      "value": "8.13등급 — V 대역 확정 전",
      "source": "첨부 catalog-values.v1.csv — dso:M32; inputs/catalog-values.v1.csv의 원본 행"
    },
    {
      "label": "각크기(첨부)",
      "value": "7.74′ × 4.86′ — 카탈로그 범위",
      "source": "첨부 catalog-values.v1.csv — dso:M32; inputs/catalog-values.v1.csv의 원본 행"
    },
    {
      "label": "거리(외부 소개값)",
      "value": "약 250만 광년 — 첨부 빈칸; 해당 출처의 추정",
      "source": "NASA — Messier 32 — https://science.nasa.gov/mission/hubble/science/explore-the-night-sky/hubble-messier-catalog/messier-32/"
    },
    {
      "label": "목록 식별자",
      "value": "M32",
      "source": "첨부 catalog-values.v1.csv — dso:M32; inputs/catalog-values.v1.csv의 원본 행"
    }
  ],
  "story": {
    "ko": "르 장티가 발견한 M32는 오늘날 안드로메다은하의 동반 은하로 연구됩니다. 작고 매끈한 빛점처럼 보이는 모습 때문에 초보자의 시야에서는 별과 쉽게 섞이지만, 그 빛의 상당 부분은 많은 별이 합쳐 만든 것입니다. 허블의 정밀 관측은 이런 작은 은하 안의 별들을 조사하며 주변 은하계의 역사를 살피는 데 쓰입니다. 소형 망원경으로 같은 세부를 보려 하기보다는 M31의 넓은 빛과 M32의 작은 중심을 비교해 보세요. 지구에서 보이는 크기나 표면의 모양이 다르다는 사실을 직접 기록하는 것만으로도 두 대상의 차이를 설명할 수 있습니다. 별 같은 점을 무조건 별로 분류하지 않고, 위치와 퍼짐을 함께 확인하는 과정은 은하 관측에서 특히 중요합니다. 찾은 뒤에는 지도 표식이 아니라 실제로 구별한 모습이 무엇인지 남겨 보세요.",
    "cultures": [
      "기타"
    ],
    "sources": [
      "NASA — Messier 32 — https://science.nasa.gov/mission/hubble/science/explore-the-night-sky/hubble-messier-catalog/messier-32/"
    ]
  },
  "howToFind": {
    "ko": "가을에 안드로메다자리에서 M31을 먼저 찾습니다. M31 중심에서 천구의 남쪽으로 약 0.4° 이동해 M32 위치를 확인합니다. 저배율에서 별 같은 중심을 찾고 주변 별과 비교하며 작은 퍼짐이 있는지 살핍니다.",
    "season": "autumn",
    "hopFrom": [
      "dso:M31",
      "const:And"
    ]
  },
  "observing": {
    "nakedEye": "M31과 별개 은하로 맨눈 분리하는 목표로 삼지 않습니다.",
    "binoculars": "10×50에서는 M31 옆 작은 점과 혼동하기 쉽습니다. 분명히 구분되지 않으면 미검출로 남깁니다.",
    "telescope": "90mm 20~80배로 작은 밝은 중심과 짧은 퍼짐을 찾는 목표를 권합니다. 도시에서는 별과 구별하기 어려울 수 있습니다.",
    "difficulty": 4,
    "bestMonths": [
      10,
      11,
      12
    ]
  },
  "sources": [
    "첨부 catalog-values.v1.csv — dso:M32; inputs/catalog-values.v1.csv의 원본 행",
    "첨부 G2 constellations_ko.csv — inputs/constellations_ko.csv; 한국어명·IAU 약어·속격",
    "편집 제안 — observing-policy.md; 북위36.35°·10×50·90mm 20~80배, 실측 아님",
    "첨부 catalog-values.v1.csv — 길잡이 연계 행: dso:M31, const:And; inputs/catalog-values.v1.csv",
    "NASA — How to Find Good Places to Stargaze — https://science.nasa.gov/solar-system/how-to-find-good-places-to-stargaze/",
    "NASA — Messier 32 — https://science.nasa.gov/mission/hubble/science/explore-the-night-sky/hubble-messier-catalog/messier-32/",
    "첨부 catalog-values.v1.csv — dso:M32; inputs/catalog-values.v1.csv의 원본 행; NASA — Messier 32 — https://science.nasa.gov/mission/hubble/science/explore-the-night-sky/hubble-messier-catalog/messier-32/",
    "첨부 catalog-values.v1.csv — dso:M32; inputs/catalog-values.v1.csv의 원본 행; 첨부 G2 constellations_ko.csv — inputs/constellations_ko.csv; 한국어명·IAU 약어·속격"
  ],
  "meta": {
    "generatedBy": "gpt-5-pro",
    "generatedAt": "2026-09-07",
    "confidence": "medium",
    "needsReview": [
      "장비별 관측 안내·추천 월·난이도는 보수적인 편집 제안입니다. 실제 기기·날씨·광해에서 관측 성공을 보장하지 않습니다.",
      "첨부 영어 이름은 빈칸으로 보존했습니다. title.en에는 새 고유명을 만들지 않고 목록 식별자를 표시용으로 사용했습니다.",
      "원본 거리 빈칸은 유지했습니다. 사실표의 거리는 외부 소개값임을 명시했으며 최신 단일 정답으로 취급하지 않습니다.",
      "입력 mag 열의 측광 대역이 확인되지 않았습니다. V등급으로 재명명하거나 검증 전 밝기 비교 퀴즈에 사용하지 않습니다.",
      "첨부 각크기는 해당 카탈로그의 측정/선택 범위로 보존했습니다. 사진 전체 윤곽·성단 구성원 전부·도시에서 보이는 경계와 동일하다고 보장하지 않습니다."
    ]
  }
}
